ID  объявления,Тип,Площадь,Адрес,Цена,Телефоны,Описание,Ссылка на объявление
306110468,Продажа коммерческой земли,"4.0, сот.","Республика Дагестан, Каспийск, проспект Акулиничева","1100000 руб., УСН",79886904195,"Продаются земельный участок на берегу моря Каспийска пятый турали четыре сотых срочно республики Дагестан карабудахкентский район, 5 фото",https://www.cian.ru/sale/commercial/306110468
314009232,"Продажа коммерческой земли, здание","300.0, м2","Республика Дагестан, Каспийск, Кемпинг мкр, 48-я линия","6840000 руб., УСН",79896601483,"— МKP КeмпингПрoдaется земельный учaстoк 3 сотыx! ИЖСДинaмичнo рaзвивaющийcя paйoн гoрода, так жe рядом cтроят (IQ-Квартал), будет аллея, инфpacтруктуpа будeт нaмного интepеcнее! Paйон заceлeнный, зaезд c улицы Зейнутдинa Бaтманова (бывшaя Кизилюpтовская)!Все коммуникaции - газ, свeт, вoда, кaнaлизация!Рядом новые 2 школы, 2 дет. сада, куча магазинов и прочего.. ППД - полный пакет документов ( зеленка )!Компания SN - специалист Руслан, 8 фото",https://www.cian.ru/sale/commercial/314009232
309040590,Продажа коммерческой земли,"1.0, га","Республика Дагестан, Каспийск, Азимут СНТ","15000000 руб., УСН",79887802865,"Внимание !

Эксклюзивный вариант в этом районе,так как все земли уже раскуплены,полный пакет Документов! СОБСТВЕННОСТЬ , 1Гектар Земли 

Перспективный район,подъезд к участку уже асфальтируют,проводятся все коммуникации

Выгодное предложение на рынке недвижимости, 1 фото",https://www.cian.ru/sale/commercial/309040590
316111939,Продажа коммерческой земли,"8.0, сот.","Республика Дагестан, Каспийск, улица Коттеджная","18300000 руб., УСН",79894939627,"Арт. 95943692 Участок земли площадью 8 соток выставлен на продажу в престижном районе Каспийска, прямо напротив знаменитой ""Анжи Арены"". Удобное  расположение делает его идеальным для реализации рекреационных проектов любой сложности. 

Непосредственная близость к морю открывает хорошие возможности для создания объектов туристической инфраструктуры: от комфортабельных гостиниц и апартаментов до современных спортивно-оздоровительных комплексов, санаторий и прочее. 

Развитая транспортная доступность и близость к ключевым городским объектам. 

Почему выгодно инвестировать в этот участок?
Текущая рыночная стоимость земли ниже ее реальной ценности. 
Возможные варианты использования участка разнообразны: от жилищного строительства до коммерческих проектов. Это дает инвестору гибкость в реализации наиболее прибыльной. 
За более подробной консультацией звоните!, 1 фото",https://www.cian.ru/sale/commercial/316111939
305225685,Продажа коммерческой земли,"30.0, сот.","Республика Дагестан, Каспийск, улица Маячная","30000000 руб., УСН",79884501971,"Продам или сдам в аренду. Также рассмотрю варианты бартера. Местоположение удачное: 50 м вдоль дороги; 60м -в глубину. Дорога асфальтированная. Все документы в порядке. Посредникам не беспокоить! Если не дозвонитесь, напишите. Торг уместен., 4 фото",https://www.cian.ru/sale/commercial/305225685
