ID  объявления,Тип,Площадь,Адрес,Цена,Телефоны,Описание,Ссылка на объявление
318735186,Продажа коммерческой земли,"1.04, га","Воронежская область, Павловский район, Павловск, Восточный-2 мкр, улица Железнодорожная, 5","33000000 руб., УСН",79856573416,"Продам земельный участок в г. Павловск промышленного назначения на территории ТОСЭР (Территория опережающего социально-экономического развития)с льготными налоговыми условиями и иными привилегиями.

Участок имеет выгодное расположение с точки зрения логистики в одном километре от магистрали М4 ""ДОН""
Территория обнесена забором, имеет два въезда и всю необходимую инфраструктуру (свет, газ, вода, канализация)
Общая площадь = 10393м2

Продажа от собственника!!!, 13 фото",https://www.cian.ru/sale/commercial/318735186
