ID  объявления,Тип,Площадь,Адрес,Цена,Телефоны,Описание,Ссылка на объявление
319815277,Продажа коммерческой земли,"40.0, сот.","Кабардино-Балкарская Республика, Терский район, Терек, улица Мамхегова","6000007 руб., УСН",79187230263,"Продаётся земельный участок 40 соток в г. Тереке ( 1 сотка - 210 тыс )
На участке находится бывш. консервный завод (11сот - 11 млн)
участок 1 гектар
отличное месторасположение , участок находится на проезжей части дороги , рядом жд пути
все коммуникации проходят рядом
Электричество, газ, вода, канализация подведены к участку
На земельном участке находится 9 теплиц , 250 деревьев
Участок идеально подойдет под склады ,промышленное производство
 Полное юридическое сопровождение
ЗВОНИТЕ!!!


Арт. 108874910, 12 фото",https://www.cian.ru/sale/commercial/319815277
