ID  объявления,Тип,Площадь,Адрес,Цена,Телефоны,Описание,Ссылка на объявление
294257932,Продажа коммерческой земли,"407.0, сот.","Саратовская область, Вольск, улица Степана Разина, 32А","29999000 руб., УСН",79170212015,"В продаже участок , расположен по адресу г .Вольск , улица Степана Разина ,34
Подведен газ высокого давления 
Электроэнергия с разрешенной мощностью 3МВт 
Имеется городская канализация и водоснабжение.
К участку подходят железнодорожные пути 
Участок расположен на берегу реки Волга. Наличие судового хода позволяет использовать данный участок для организации причала для погрузки.
Отведена водная акватория для строительства причала., 16 фото",https://www.cian.ru/sale/commercial/294257932
320180287,Продажа коммерческой земли,"6.0, сот.","Саратовская область, Вольск","268000 руб., УСН",79873220630,"Данные получены с сайта ГИС Торги.
Земельный участок, площадью 600 кв.м., кадастровый номер: 64:42:010490:265, расположенный по адресу: Российская Федерация, Саратовская область, Вольский муниципальный район, Вольское муниципальное образование, город Вольск, ул. Аткарская, земельный участок 28 А. Категория земель: земли населённых пунктов. Вид разрешённого использования: для индивидуального жилищного строительства., 2 фото",https://www.cian.ru/sale/commercial/320180287
320180285,Продажа коммерческой земли,"8.98, сот.","Саратовская область, Вольск","304000 руб., УСН",79873220630,"Данные получены с сайта ГИС Торги.
Земельный участок, площадью 898 кв.м., кадастровый номер: 64:42:010450:275, расположенный по адресу: Российская Федерация, Саратовская область, Вольский муниципальный район,  г.Вольск, ул.Овражная, земельный участок, 12 А. Категория земель: земли населённых пунктов. Вид разрешённого использования: для индивидуального жилищного строительства., 2 фото",https://www.cian.ru/sale/commercial/320180285
320180286,Продажа коммерческой земли,"7.15, сот.","Саратовская область, Вольск","378000 руб., УСН",79873220630,"Данные получены с сайта ГИС Торги.
Земельный участок, площадью 715 кв.м., кадастровый номер: 64:42:010484:310, расположенный по адресу: Российская Федерация, Саратовская область, Вольский муниципальный район,  муниципальное образование город  Вольск, город Вольск, ул.Кукушкина, земельный участок 10 Б. Категория земель: земли населённых пунктов. Вид разрешённого использования: для индивидуального жилищного строительства., 2 фото",https://www.cian.ru/sale/commercial/320180286
302611652,"Продажа коммерческой земли, здание","4500.0, м2","Саратовская область, Вольск, Малыковская улица, 14","19500000 руб., УСН",79873001364,"Продам земельный участок в районе конечной, находится между улицами Октябрьская и Пугачева. Цена договорная, 7 фото",https://www.cian.ru/sale/commercial/302611652
