ID  объявления,Тип,Площадь,Адрес,Цена,Телефоны,Описание,Ссылка на объявление
273016027,Продажа коммерческой земли,"0.35, га","Калининградская область, Гусевский район, Гусев, Железнодорожная улица","8000000 руб., УСН",79110742697,"Планируете бизнес на востоке области?

Предлагаю к продаже земельный участок 0,35 га в г. Гусев Калининградской области. Назначение - для размещения административных и торговых зданий. Расположен рядом с автостанцией и ж/д вокзалом. Удобные подъездные пути, новый тротуар.

Участок ровный, огорожен забором из 3Д панелей, откатные ворота. Подключены электричество, вода, канализация. Установлен павильон 20 кв. м из сэндвич-панелей.

На сегодняшний день это единственный в городе свободный участок такой площади под коммерческую застройку!
СРОЧНО
Один собственник. ГПЗУ предоставлю по запросу., 3 фото",https://www.cian.ru/sale/commercial/273016027
