ID  объявления,Тип,Площадь,Адрес,Цена,Телефоны,Описание,Ссылка на объявление
307459852,Продажа коммерческой земли,"1.5, га","Республика Крым, Евпатория, улица Строителей, 5А","50000000 руб., УСН",79186224478,"Продается участок коммерческого назначения общей площадью 1,5 га- срок аренды земли 48 лет с возможностью выкупа

Категория земель:Земли поселений (земли населенных пунктов)
Склад, Складские площадки

Параметры объекта:

- Республика Крым, г.Евпатория
- Хорошие подъездные пути, дорога асфальтирована
- Огороженная территория
- Востребованное место
- Коммуникации проходят вдоль участка

Инфраструктура:

В шаговой доступности значимая инфраструктура

Позвоните нам, чтобы назначить просмотр!, 9 фото",https://www.cian.ru/sale/commercial/307459852
319678705,Продажа коммерческой земли,"1.71, сот.","Республика Крым, Евпатория, переулок Средний","1470000 руб., УСН",79892303600,"Данные получены с сайта ГИС Торги.
земельный участок площадью 171 +/- 5 кв.м., земли населенных пунктов, с кадастровым номером 90:18:010135:4846, расположенный по адресу: Республика Крым, г. Евпатория, пер. Средний., 1 фото",https://www.cian.ru/sale/commercial/319678705
319678709,Продажа коммерческой земли,"4.05, сот.","Республика Крым, Евпатория, улица Заводская, 84","1866000 руб., УСН",79892303600,"Данные получены с сайта ГИС Торги.
земельный участок с кадастровым номером 90:18:010168:2317, площадью 405 +/- 7 кв.м., земли населенных пунктов, расположенный по адресу: Республика Крым, г. Евпатория, СТ ""Садовод"", ул. Заводская 83. (На земельном участке имеется строение с кадастровым номером  90:18:010168:2582, решение суда о принудительной продаже на данное строение отсутствует)., 1 фото",https://www.cian.ru/sale/commercial/319678709
319678711,Продажа коммерческой земли,"6.01, сот.","Республика Крым, Евпатория, улица Вишневая, 49","5290000 руб., УСН",79892303600,"Данные получены с сайта ГИС Торги.
земельный участок с кадастровым номером 90:18:010155:1345, площадью 601 +/- 9 кв.м., земли населенных пунктов, расположенный по адресу: Республика Крым, г. Евпатория, ул. Вишневая, 49. (На земельном участке расположены строения с кадастровыми номерами 90:18:010155:3892, 90:18:010155:3893, 90:18:010155:3894, принадлежащие гр. Украины Гольцову И.В. и решение суда о принудительной продаже на данные строения отсутствуют)., 1 фото",https://www.cian.ru/sale/commercial/319678711
319678712,Продажа коммерческой земли,"4.22, сот.","Республика Крым, Евпатория, улица 9 Мая, 16","5381350 руб., УСН",79892303600,"Данные получены с сайта ГИС Торги.
земельный участок пл. 422 кв.м., к/н 90:18:010149:67, земли населенных пунктов, вид разрешенного использования - для индивидуального жилищного строительства, Республика Крым, г. Евпатория, ул. 9 Мая, д. 16. (На земельном участке находится строение к/н 90:18:010147:2966, которое принадлежат гражданке Украины Цвейбель Л.Н. и решение о принудительной продаже на данный объект отсутствует)., 1 фото",https://www.cian.ru/sale/commercial/319678712
319006094,Продажа коммерческой земли,"25.0, сот.","Республика Крым, Евпатория, Санаторный мкр","40000000 руб., УСН",79183724215,"Продажа участка 650м до моря в центре города, назначение под гостиницу, можно под любой вид деятельности, все коммуникации есть, град план, участок угловой, 12 фото",https://www.cian.ru/sale/commercial/319006094
265624751,Продажа коммерческой земли,"1.0, га","Республика Крым, Евпатория, набережная Лазурная","79000000 руб., УСН",79885210208,"СОБСТВЕННИК.  УНИКАЛЬНОЕ ПРЕДЛОЖЕНИЕ НА ПЕРВОЙ ЛИНИИ!
Продается участок (около 1Га) в Евпатории по аллее Дружбы. 
ПРАВОВОЙ СТАТУС И ЦЕЛЕВОЕ НАЗНАЧЕНИЕ: Все документы оформлены по законодательству РФ. Имеются кадастровая выписка (состоит из двух участков). Межевание проведено. 
Вид права: СОБСТВЕННОСТЬ с 2011 г. 
Категория земель: Земли поселений. 
Вид разрешенного использования: ИЖС. 
Расположен на территории РН (Зона отдыха и туризма) 
Расстояние до центрального парка Евпатории 12 км. 
Здесь расположены санатории, пансионаты, детские дома отдыха, гостевые дома, мини-отели. Предлагаемый участок находится на ПЕРВОЙ ЛИНИИ, выходит на идеальный песчаный пляж, чистую зону морского побережья с пологим входом, 85 м от уреза воды. Рельеф местности абсолютно ровный. Подъездная дорога с качественным асфальтобетонным покрытием. 
ОСОБЕННОСТИ: на участке проведены инженерно-геологические работы для проектной документации (май 2021г.) 
КОММУНИКАЦИИ: На участке КТП мощностью 600 кВт, собственником к ..., 3 фото",https://www.cian.ru/sale/commercial/265624751
320463210,Продажа коммерческой земли,"900.0, сот.","Республика Крым, Евпатория, улица Эскадронная","1100000000 руб., УСН",79892315465,"Пpодaeтся земельный учaсток, площадью 9 Гa, коммeрчeскогo нaзнaчения, в г. Eвпaтopия, пo ул. Эcкадронной.

2-я линия (около 200 м. до Чepногo мoря). C вocточной стopоны учaсткa - oзeрo Сaсык. 

K учacтку примыкaет аcфaльтировaннaя доpoга, имeeтcя пoдъезд со cтоpоны ул. Эскaдрoнной. 

K участку подведены все коммуникации (электроэнергия, газ, водоснабжение, водоотведение), заключены договоры технологического присоединения. Имеется ГПЗУ. 

Участок в аренде на 49 лет, до 2072 г. 

Категория земель: Земли населенных пунктов. 
Разрешенное использование: Многоэтажная жилая застройка (высотная застройка), обслуживание жилой застройки, туристическое обслуживание

На участке расположены 26 нежилых зданий. Собственником объектов является юридическое лицо.

Арт. 112312723, 8 фото",https://www.cian.ru/sale/commercial/320463210
