ID  объявления,Тип,Площадь,Адрес,Цена,Телефоны,Описание,Ссылка на объявление
319116627,Продажа коммерческой земли,"4.0, сот.","Иркутская область, Иркутск, улица Тимирязева, 40","6485000 руб., УСН",+79842704977,"Продажа земельного участка в самом сердце города!

Уникальное предложение

Площадь: 4 сотки (400 м)  
Расположение: ул. Тимирязева, центр города  
Кадастровый номер: 38:36:000034:22460  

Почему этот участок?Идеальное место: в центре города, где жизнь никогда не останавливается.Идеально ровная форма: удобно для любого типа застройки.Статус земли: готов к строительству, без лишних хлопот.Деловое управление: идеальное место для офисов, бизнес-центров и коммерческих объектов.Компактный размер: идеально для точечной застройки, которая впишется в городской ландшафт.Электричество: свет официальный 50 кВт.Что можно построить?Современный офис: стильный и функциональный.Бизнес-центр: место, где ваш бизнес будет процветать.Административное здание: надежный офис для компании.Коммерческая недвижимость: магазин, кафе или ресторан  все что угодно!Инвестиционная выгодаВысокая ликвидность: легко продать или сдать в аренду.Прирост стоимости: земля в центре города всегда дорожает.Перспективы: отличная в ..., 4 фото",https://www.cian.ru/sale/commercial/319116627
317387875,Продажа коммерческой земли,"1.0, сот.","Иркутская область, Иркутск, Депутатская улица","8500000 руб., УСН",+79842704977,"Уважаемые покупатели!

Предлагаем вашему вниманию земельный участок площадью 1,1 сотка, расположенный во дворе жилого дома ул. Депутатская,40.

В настоящее время на участке расположено 4 гаража, но их можно убрать и возвести 1 или 2х  этажное здание для ведения коммерческой деятельности. Или оставить данные объекты и перепрофилировать под какую-либо деятельность.

Участок располагается в центре города, что дает множество преимуществ:

- возможность размещения различных видов бизнеса, таких как магазины, кафе, офисы и т.д.

- хорошая видимость и доступность для потенциальных клиентов.

Земельный участок идеально подходит для развития вашего бизнеса или инвестиций в недвижимость.

Мы готовы обсудить все ваши вопросы и предложения, а также помочь с организацией просмотра объекта.

Не упустите уникальную возможность приобрести земельный участок в центре города с огромным потенциалом для развития!

Свяжитесь с нами для получения дополнительной информации и консультации.

Наша компания гаран ..., 5 фото",https://www.cian.ru/sale/commercial/317387875
291441488,Продажа коммерческой земли,"9.0, сот.","Иркутская область, Иркутск, улица Баррикад, 77","18000000 руб., УСН","+79149505781, +79834403180","ОТ СОБСТВЕННИКА БЕЗ КОМИССИИ.

Продается участок 9 соток на Баррикад 77.Первая линия, высокий автомобильный трафик. Расположен напротив Казанской церкви, на пересечении Баррикад и ул.Декабристов.Кадастровый 38:36:000018:906.На участке дом 132кв.м. Назначение земли и дома: торговое. рядом с участком проходят центральные холодное водоснабжение и канализация., 5 фото",https://www.cian.ru/sale/commercial/291441488
319943146,Продажа коммерческой земли,"53.0, сот.","Иркутская область, Иркутск, улица Нефтебаза, 5","25000000 руб., УСН",+79836917135,"Уважаемый покупатель!

Продается База 53 сотки земли, строения 650 м2.

Боксы частично сданы в аренду и приносят пассивный доход! 

Боксы раздельные, территория огорожена, есть своя котельная, 50 кВт. электроэнергии.

Так же есть оборудование для производства пескоблоков и декоративного камня.

Звоните, записывайтесь на просмотр, отвечу на все ваши интересующие вопросы!

Ваш агент Сергей Бутырин!, 5 фото",https://www.cian.ru/sale/commercial/319943146
318725218,Продажа коммерческой земли,"188.5, сот.","Иркутская область, Иркутск, Горка тер.","25500000 руб., УСН",+79148811306,"Арт. 107408055 Предлагаем Вашему вниманию земельный участок 18 849 кв. метров 

СМОТРИ ВИДЕООБЗОР ЭТОГО ОБЪЕКТА!

Кадастровый номер участка: 38:36:000006:245
Категория земель: земли населенных пунктов
Вид разрешенного использования: для эксплуатации существующего подъездного железнодорожного пути

Рассмотрим все варианты предложений, обмен, рассрочка и т. д.

Гарантия юридической чистоты сделки от компании.
Этот объект можно купить в ипотеку по сниженной ставке от 14.75%

Звоните. Записывайтесь на показ объекта прямо сейчас.
Рады будем ответить на все ваши вопросы, 27 фото",https://www.cian.ru/sale/commercial/318725218
299089601,Продажа коммерческой земли,"58.0, сот.","Иркутская область, Иркутск, Толевая улица, 1А","30000000 руб., УСН",+79149157761,"Продается участок 58 соток с ж/д тупиком по ул. Толевая, есть подъездные пути для фур.
 собственность.

Цена 30 млн.руб, 1 фото",https://www.cian.ru/sale/commercial/299089601
315278629,Продажа коммерческой земли,"6.7, сот.","Иркутская область, Иркутск, улица Олега Кошевого, 65В/3","49999999 руб., УСН",+79148811306,"Арт. 98685495 Предлагаем Вашему вниманию земельный участок на первой линии по улице Олега Кошевого

6,7 соток земли, павильон 90 квадратных метров используемый под магазин автозапчастей грузового автотранспорта, выход на железнодорожную ветку

Наличие за павильоном залитой монолитной плиты для возведения складского или производственного объекта

Рассматриваем любые предложения

Быстрый выход на сделку
Гарантия юридической чистоты сделки от компании

Звоните. Записывайтесь на показ объекта прямо сейчас. 
Рады будем ответить на все ваши вопросы, 15 фото",https://www.cian.ru/sale/commercial/315278629
316058744,Продажа коммерческой земли,"100.0, сот.","Иркутская область, Иркутск, Полярная улица, 97","99000000 руб., УСН",+79149314084,"Продам земельный участок площадью 1Га (100соток)  с капитальными складскими помещениями  площадью 500 м2  выделенным  электричеством мощностью =1 МВТ  (цена 110 млн.р.)  возможно увеличение мощностей и площади земельного участка , на охраняемой территории имущественного комплекса 3га площадями более 12000м2. 

ИМУЩЕСТВЕННЫЙ КОМПЛЕКС НА ПОЛЯРНОЙ-ТЕРРИТОРИЯ БЫВШЕГО МЯСОКОМБИНАТА !  приглашаем инвесторов и производителей к сотрудничеству.

Преимущества имущественного комплекса:
_ Удобное месторасположение в ЧЕРТЕ ГОРОДА и удобные дорожные развязки , набережная реки Ангара. Рядом остановки общественного транспорта , жилье, магазины.
_Действующий Железнодорожный тупик готов к эксплуатации (на обслуживании у РЖД).
_1ая линия от центральной улицы Полярная , 2 а отдельных заезда на территорию комплекса (С улицы Полярная и с проулка)
_Заведённая запас мощность Электричества до 5 МВТ , отделены подстанции в отдельностоящим зданием.
_Заведена центральная канализация (здание компрессорной).
_ Холо ..., 7 фото",https://www.cian.ru/sale/commercial/316058744
320239600,Продажа коммерческой земли,"2.0, га","Иркутская область, Иркутск, Ново-Ленино мкр, Горка-2 тер.","100000000 руб., УСН",+79842709667,"В продаже участок пром назначения 2 ГА.

Лучше предложение из аналогичных в Иркутске!
 
 Представляем к покупке отличный участок промышленного назначения, для производства или обработки в любой отрасли.
 
 На территории оборудованы железнодорожные пути (жд тупик), что позволит организовать ввоз и вывоз всего необходимого.
 
 Также, на территории находится сооружение бывшего ВТОРЧЕРМЕТ. При желании, настоящие собственники организуют демонтаж постройки и очистят территорию полностью.
 
 Территория полностью огорожена бетонным забором, ведется видеонаблюдение.
 
 Участок находится на первой линии двух улиц, что потенциально позволит сделать удобные зоны въезда. 
 
Удобное расположение вблизи Московского тракта обеспечит комфортную логистику в любом направлении.

 ГОТОВЫ РАССМОТРЕТЬ ДОЛГОСРОЧНУЮ АРЕНДУ.

Показ объекта осуществятся в заранее оговорённое время., 18 фото",https://www.cian.ru/sale/commercial/320239600
319296059,Продажа коммерческой земли,"217.0, сот.","Иркутская область, Иркутск, Байкальский тракт, 8-й км","149000000 руб., УСН",+79836917135,"Предлaгаем Baшeму вниманию уникальный земельный учaстoк, рacпoложенный нa 23 километpe Бaйкaльcкого тракта. 10 минут от городa пo acфaльтировaнной доpогe.

ПEPBАЯ ЛИHИЯ У BОДЫ. ПИРС

Oбщaя плoщaдь: 2,2 гeктара.Участoк чистый, суxoй, рoвный, выcокиe вeковые cocны, бepезы.Вид paзpешeннoго использования - для спортивной базы.О сделке: Один взрослый собственник Без обременений. Быстрый выход на сделку.Полную информацию и бесплатную консультацию можно получить у менеджера, связавшись с нами по телефону или посетив наш офис, расположенный по адресу: г. Иркутск, ул. Омулевского, 20/2., 9 фото",https://www.cian.ru/sale/commercial/319296059
298919760,Продажа коммерческой земли,"147.0, сот.","Иркутская область, Иркутск, Трактовая улица, 18/6","179990000 руб., УСН",+79149157761,"Продается участок на 1 линии ул. Трактовая, площадь 1,5га, идеально подойдет под строительство складского комплекса  или ТЦ.

Цена 180 млн.руб., торг, 1 фото",https://www.cian.ru/sale/commercial/298919760
315075028,"Продажа коммерческой земли, здание","20.0, м2","Иркутская область, Иркутск, улица Марии Цукановой","1000000 руб., УСН",+79149505092,"пpодaм дeйcтвующую автoпaрковку (готовый бизнeс)фoрмa сoбственнocти- аpeндa у гocударства cрoк - аpeндa нa неoпрeдeлeнный срок paзрeшённый вид дeятельноcти- для paзмещeния откpытой aвтопapкoвкиплощaдь - 12.5 сoтoк парковкa + 7.5 сотoк за фактичеcкоe пoльзoвание элeктроэнергия -40квттерритория огорожена заборомна территории есть бытовка для сторожей, 60 парковочных мест, 6 фото",https://www.cian.ru/sale/commercial/315075028
295348061,Продажа коммерческой земли,"10.0, сот.","Иркутская область, Иркутск, Байкальская улица","6000000 руб., УСН",+79834006037,"Продам земельный участок 10 соток напротив ЖК СанСити и рядом со школой Точка будущего участок кад. номер 38:06:141401:601. Продается 10 -20 -30 -40-50 -60 -70 сот. вдоль автодороги. Назначение -коммерция. На участке возможно возведение объектов некапитального строительства. До границы участка подведена эл.эн до 200кВт., 3 фото",https://www.cian.ru/sale/commercial/295348061
311642835,Продажа коммерческой земли,"5.13, сот.","Иркутская область, Иркутск, Сибиряк СНТ","6250000 руб., УСН","+79148712787, +79149156463","Продам участок с возможностью использования под комерцию с выходом на улицу Култукская в районе средне ушаковского моста! Получены тех условия на подключения центральной воды и света!!! РЯДОМ УЧАСТКИ ИСПОЛЬЗУЮТСЯ ПОД КОМЕРЧЕСКУЮ ДЕЯТЕЛЬНОСТЬ!, 4 фото",https://www.cian.ru/sale/commercial/311642835
220190057,Продажа коммерческой земли,"4.0, сот.","Иркутская область, Иркутск, улица Тимирязева, 40","8500000 руб., УСН","+79140105344, +79834604200","Продается земельный участок в центре г. Иркутска, на ул. Тимирязева, рядом с центральным рынком. Кадастровый номер 38:36:000034:22460. Имеется распоряжение на получение разрешения на условно разрешенный вид использования ""Деловое управление"".",https://www.cian.ru/sale/commercial/220190057
315017199,Продажа коммерческой земли,"11.27, сот.","Иркутская область, Иркутск, улица Аносова, 3","9750000 руб., УСН",+79834607823,"Арт. 98066958 Здравствуйте, уважаемые покупатели.

Хочу предложить участок с постройками на территории 11,27 соток, 1-ЛИНИЯ, ОТЛИЧНОЕ ВЛОЖЕНИЕ ВЫГОДНАЯ ИНВЕСТИЦИЯ! 
Адрес: Иркутск, ул. Аносова 3.

Идеальная локация для автосервиса , разборки, стоянки  и т.д.
Участок ровный,  первая линия,  большой трафик. 

С каждым годом объект будет расти в цене.

Городской пляж Якоби в 3 минутах пешком.

Участок весь ровный, подъездные пути отличные.

Локация супер, все в шаговой доступности: школы детские сады, частные сады, спорт залы, пик любви открывается вид на весь город классный)

Ресторанный комплекс Мираж, в шаговой доступности.

Строится современная школа в 700 метрах от дома.

улица Мухиной полностью застраивают классными жк.

Звоните, покажу в любое время , дорогие покупатели.

Риэлтор : Олег Сергеевич, 12 фото",https://www.cian.ru/sale/commercial/315017199
320041109,Продажа коммерческой земли,"6.7, сот.","Иркутская область, Иркутск, улица Халтурина, 14","9900000 руб., УСН",+79148722538,"Арт. 57715426 Продам земельный участок.
Площадь участка 6, 7 соток
На участке находится дом под снос.
Кадастровый номер 38:36:000034:22252.

По всем дополнительным вопросам готов ответить по телефону.

Специалист по недвижимости Куклин Алексей.
_________________________________________________ _____



Наш отдел коммерческой недвижимости владеет самым развернутым рынком во всех ценовых категориях.
.
Юридический отдел проследит за сопровождением и безопасностью вашей сделки.
Ипотечный брокер подберет для вас самые лучшие условия банков.
Желание клиента с нами исполняется на 100%.
Звоните, буду рад помочь., 1 фото",https://www.cian.ru/sale/commercial/320041109
315430396,Продажа коммерческой земли,"11.85, сот.","Иркутская область, Иркутск, пос. Жилкино","15000000 руб., УСН",+79149155679,"Арт. 99050163 Продажа ЗУ 11,84 соток на первой линии от дороги и р. Ангары.  

Первая линия от дороги.
Первая линия от р.Ангара.
Все коммуникации центральные.
Эл.эн 50 кВт ( можно увеличить по договоренности)
Автопарковка асфальтированная рядом с ЗУ.
Асфальтированные подъездные пути.
Большой автомобильный трафик

ЗУ участок подходит под любой вид деятельности; магазины, рестораны, кафе, (общепиты), СТО, торговые точки (рынки), офисы с красивым видом на Ангару, базы и т.д.      

**Краткая информация о локации**
   Наш объект расположен на первой линии Московского тракта М-53 и автомагистрали, которая соединяет все районы и города Иркутской области. Удобные подъездные пути для любого вида транспорта — от легковых автомобилей до фур.
   В непосредственной близости находятся магазины автозапчастей, производства.. Также оптовые торговые базы и рынки, производственные базы, крупные автосалоны, складские комплексы, станции технического обслуживания, заправки и т.д.

Для более подробной инфор ..., 5 фото",https://www.cian.ru/sale/commercial/315430396
222340654,Продажа коммерческой земли,"8.0, сот.","Иркутская область, Иркутск, Партизанская улица, 44","16000000 руб., УСН",+79149516724,"Продается участок под коммерческую недвижимость в центре города, в шаговой доступности от Центрального рынка. Участок в зоне застройки ЖЗ-104, предназначен под многоэтажные здания с подземной парковкой, под торговые и бизнесцентры, гостиницы, для дошкольных и школьных зданий и тд. Возможна продажа с соседним участком в размере 12 соток. Участок в собственности. Продажа без посредников., 1 фото",https://www.cian.ru/sale/commercial/222340654
