ID  объявления,Тип,Площадь,Адрес,Цена,Телефоны,Описание,Ссылка на объявление
314285592,Продажа коммерческой земли,"30.0, сот.","Иркутская область, Иркутск, Полярная улица, 97","19300000 руб., УСН",+79149155679,"Арт. 96508770 Продаёт земельный участок 30 +/- соток с центральными коммуникациями, г. Иркутск, в Жилкино.

Почти первая линия.
150 метров асфальтированная дорога до ЗУ от ул. Полярной.
30 соток ( есть возможность приобрести до 50 соток +/-).
Назначение коммерция, производства...
Рядом ж/д пути.
Два здания без крыши: 1) 36 м х 12 м, 2) 12 м х 24 м. Материал стен - кирпич. Высота стень - 3,5 метра. ( Здания стоят на кадастровой карте).
Эл.Эн - 50 кВт (можно увеличить, есть договоренность).
Центральный коммуникации: ХВС и канализация.
Подъездные пути для крупногабаритных авто, фур...    
Ровный участок.

**Краткая информация о локации**

  Наш объект расположен рядом с Московского тракта М-53 и автомагистрали, которая соединяет все районы и города Иркутской области. Удобные подъездные пути для любого вида транспорта — от легковых автомобилей до фур.
  В непосредственной близости находятся магазины автозапчастей, производства.. Также оптовые торговые базы и рынки, производственные базы, к ..., 4 фото",https://www.cian.ru/sale/commercial/314285592
284313670,Продажа коммерческой земли,"34.0, сот.","Иркутская область, Иркутск, пос. Энергетиков","45000000 руб., УСН",+79834614236,"Описание
Продам земельный участок. S = 3410 кв.м. К. 38:36:000027:14961. Коммуникации на участке.

Рассмотрим варианты.Больше информации по телефону.Разумный торг., 1 фото",https://www.cian.ru/sale/commercial/284313670
315962719,Продажа коммерческой земли,"68.0, сот.","Иркутская область, Иркутск, Полярная улица, 97","51000000 руб., УСН",+79149155679,"Арт. 100253488 Продаю земельный участок 1 га под делового назначения. 

ЗУ 68 га. можно увеличить до 3 га
Ровная, огороженная.
Центральный коммуникации.
150 кВт эл.эн. (можем увеличить мощности, 1 МВт — 30 млн. Всё обсуждаемо, звоните ;)
Не болотистая, огороженная.
Есть строения небольшое на участке.
Широкие хорошие подъездные пути и для крупногабаритных машин.

  В наличии по 3, 5, 10, 12, 30 и 50 соток разные деловые (коммерческие) ЗУ участки по городу и области. Некоторые участки находятся по локации на первой линии автодороги, у воды и в промышленных зонах. Также в некоторых ЗУ есть строения и ЖД пути. Отлично подходят под: магазин, ресторан, производство, СТО, стоянку, рынок, здание капитального строения и т. д. 

 Для получения более подробной информации звоните, и мы всё покажем и расскажем.:), 4 фото",https://www.cian.ru/sale/commercial/315962719
301241818,Продажа коммерческой земли,"22.0, сот.","Иркутская область, Иркутск, улица Баррикад, 35","75000000 руб., УСН",+79140123446,"Участок 20,37 сот (промназначения), по факту 22 сот

Находится в черте города, по адресу: 
Иркутская область, г. Иркутск, Куйбышевский район, ул. Баррикад, 35

Назначение: предпринимательство, объекты придорожного сервиса - идеально подойдет под автобизнес: ремонт, обслуживание, мойка авто, детейлинг, продажа автотоваров и подобное.

На участке расположен новый построенный дом  Объект Культурного Наследия. Проблем собственнику он не создает совсем, только соседям вокруг, но это ваш козырь в переговорах. 
Дом двухэтажный  220 м2. Хорошо может подойти под административное здание будущего автобизнеса - на первом и втором этаже по две большие комнаты по 90 м2 каждая, и есть классный кабинет руководителя с остеклением, с него все видно, что происходит на участке и вокруг.

За домом со стороны ул. Освобождения есть еще земля, которую можно использовать под стройку склада или, к примеру, производственного помещения, там порядка 5 соток. Также есть заезд с ул. Освобождения, ворота открываются. ..., 6 фото",https://www.cian.ru/sale/commercial/301241818
309156427,Продажа коммерческой земли,"16.0, сот.","Иркутская область, Иркутск, улица Лапина, 23","84500000 руб., УСН",+79832409293,"Пpодaется в центрe города кoммеpческaя нeдвижимoсть, нeдoстpoeнный тopговый павильон, 
плoщaдью 384 кв.м (24 x 16 м) в центре г. Иркутскa, угoл ул. Дзeржинcкoгo и ул. Лапина, (пеpвaя линия). Пpeкpacнoe местoраcположeние, бoльшая пpоxoдимость людей и aвтотpанcпopтa, рядом остaновки общeственного транспорта.
Фасад павильона выходит на ул. Дзержинского. Перед павильоном находится минисквер МЧС. 
Павильон расположен на земельном участке, площадью 16 (сот). На земельном участке можно разместить дополнительно автостоянку, автомойку, торговые киоски или другую коммерческую недвижимость. В том числе перед павильоном имеется площадка под летнюю веранду.
Категория земель: земли населенных пунктов.
Разрешенное использование: объекты административного-делового назначения.
Кадастровый номер: 38:36:000034:21414
Имеется место под автостоянку на 20-25 автомобилей.
Все документы готовы для продажи.
Торг возможен за наличный рассчёт возможен обмен на недвижимость в г. Москва.., 5 фото",https://www.cian.ru/sale/commercial/309156427
319782106,Продажа коммерческой земли,"44.0, сот.","Иркутская область, Иркутск, улица Рабочего Штаба","100000000 руб., УСН",+79149115698,"Предлагаем вашему вниманию земельный участок под коммерческое использование на первой линии центральной улицы Куйбышевского района, гор. Иркутска.


Есть электричество 250 квт., возможность получить тех.условия на присоединение к центральной канализации.

Участок может быть использован в качестве площадки под разные инвестиционные проекты:
Строительство объекта деловой активности
Возведение объекта развлекательного направления.

Так же данная площадка интересна в качестве перспективного развития для квартальной застройки МКД в которой можно сочетать объекты делового и развлекательного направления.

_______________________________________

Мы можем быть для вас полезны:

- купля-продажа, аренда коммерческой недвижимости по РФ
- управление коммерческими объектами
- проектная работа
- получение разрешительной документации
- смена видов разращённого использования, 1 фото",https://www.cian.ru/sale/commercial/319782106
315129728,"Продажа коммерческой земли, здание","5300.0, м2","Иркутская область, Иркутск","110000000 руб., УСН",+79832414208,"Земельный учacток плoщaдью 5364 кв.м  на первой линии вдоль дoрoги с большим автoмoбильным трaфикoм.Учacтoк oбecпечен электpоcнабжeниeм oт сoбственной KTПH мoщнoстью 630 квт по II категории. Все центpaльные кoммуникации рядoм.Зонa дeлoвого, общecтвенного и кoммерческoгo нaзначения, OДЗ-201, вид разpeшенногo использования  предпринимательство.
           Участок находится в многофункциональной зоне, рядом ведется строительство 2х ЖК  на 120000 кв.м, подойдет под любой вид коммерческой деятельности (торговый центр, производство, магазины, автосервисы и автозаправки, стоянки и т.д.).
            Получен градплан 2024г. Имеется анализ ситуации и разработка концепции развития земельного участка (торговый центр).
           Оперативный показ, быстрый выход на сделку., 5 фото",https://www.cian.ru/sale/commercial/315129728
316051025,Продажа коммерческой земли,"150.0, сот.","Иркутская область, Иркутск, Байкальская улица, 277А","150000000 руб., УСН",+79842715336,"Арт. 100281013 Производственно-складской комплекс с развитой инфраструктурой вблизи Байкальского тракта

Предлагаем вашему вниманию уникальный объект недвижимости  готовый к использованию производственно-складской комплекс, расположенный всего в 300 метрах от Байкальского тракта, что обеспечивает удобную транспортную доступность и отличную логистику. Комплекс размещается на прямоугольном земельном участке площадью 1,5 Га (15 000 м²) в черте города, с категорией земель  земли населенных пунктов, предназначенных под эксплуатацию административных зданий и складов. Это гарантирует стабильность и упрощает любые процедуры, связанные с использованием и развитием территории.  

Уникальное предложение обусловлено следующими преимуществами:

1. Развитая инфраструктура: Комплекс включает в себя разнообразные помещения, адаптированные под различные нужды:

Административное здание (3 этажа, 431 м²): Выполнено из железобетонных панелей, обеспечивает комфортные условия для работы офисного персонала.  ..., 22 фото",https://www.cian.ru/sale/commercial/316051025
