ID  объявления,Тип,Площадь,Адрес,Цена,Телефоны,Описание,Ссылка на объявление
315880630,Продажа коммерческой земли,"60.0, сот.","Владимирская область, Камешковский район, Камешково, улица Свердлова","4000000 руб., УСН",79152148570,"Код объекта: 1552569.
 Продаётся земельный участок площадью 60 соток в городе Камешково, улица Свердлова.

Участок имеет асфальтовый подъезд и статус промышленного назначения. Коммуникации отсутствуют. Это уникальная возможность приобрести землю для строительства или других целей по выгодной цене. Участок угловой, что может быть удобно для планирования расположения объектов на нём.

Расположение участка идеально для тех, кто ценит близость к городской инфраструктуре. Он находится всего в нескольких минутах от центра города.

Мы гарантируем безопасную сделку и юридическую поддержку нашим клиентам. 

Позвоните нам прямо сейчас, чтобы узнать больше о данном участке!, 3 фото",https://www.cian.ru/sale/commercial/315880630
