ID  объявления,Тип,Площадь,Адрес,Цена,Телефоны,Описание,Ссылка на объявление
320440012,Продажа коммерческой земли,"64454.0, сот.","Курганская область, Куртамышский район, Куртамыш","11500000 руб., УСН",79126134932,"Эксклюзивное предложение! Станьте землевладельцем земельного участка 645 Га в Курганской области. 
Продажа от собственника физического лица. ЗУ не в аренде! Обременений нет! Цена уникальная!
Водоем, река на земле. Рядом поселок , электричество , газ! Дорожная качественная сетка есть, до асфальтовой дороги 3 км. 
Вид разрешенного использования: Под развитие сельского хозяйства.
Категория земель: Земли сельхоз назначения. ГПЗУ в наличии. Есть возможность изменить ВРИ / категорию ЗУ.
Подходит под сельскую ипотеку. 
Идеальный вариант под развитие сельского хозяйства, фермерства, животноводства, комбинаты пищевой продукции! 
Еще выгоднее - разведение меха ценных животных (Соболь , бобер , лиса). 
Подойдет также под развитие туристического направления.
Все вопросы по телефону. Звоните!
ID объекта в нашей базе: 9320, 17 фото",https://www.cian.ru/sale/commercial/320440012
