ID  объявления,Тип,Площадь,Адрес,Цена,Телефоны,Описание,Ссылка на объявление
311341124,Продажа коммерческой земли,"48.0, сот.","Нижегородская область, Лысковский район, Лысково, улица Нижняя Набережная, 3","4900000 руб., УСН",79108862085,"Продается земельный участок площадью 4858 кв.м. ( категория земель: земли населенных пунктов) Кад. 52:27:0090004:784.  Участок полностью заасфальтирован и обнесен забором. Имеет собственный въезд на территорию (ворота), с большой разворотной площадкой перед въездом. Электричество на участке, водопровод - городская сеть, канализация - городской коллектор. В стоимость участка входит документально оформленное в собственность складское помещение площадью 333,1 кв.м., разделенное на две равные части ( одно из них оборудовано смотровой ямой). Высота потолков (9м), наличие 2х ворот и геометрия здания, позволяет установку стеллажей и работу с помощью погрузчиков и иной техники. Весь участок, площадью 0,46га заасфальтирован и окружен забором. Находится в центре Лысково, недалеко от пристани и выезда на объездную дорогу на трассу М-7.

Номер объекта: #1/1604205/11523, 9 фото",https://www.cian.ru/sale/commercial/311341124
311140992,Продажа коммерческой земли,"36980.0, сот.","Нижегородская область, Лысковский район, Лысково, Большая Советская улица, 1","14000000 руб., УСН",79108862085,"Земельный участок (для сельхозиспользования),  расположенный вдоль Уваровского пруда, Подгорного и безымянного озер. Кад. 52:27:0000000:9 

Номер объекта: #1/1602007/11523, 20 фото",https://www.cian.ru/sale/commercial/311140992
166899350,Продажа коммерческой земли,"33000.0, сот.","Нижегородская область, Лысковский район, Лысково, улица Мичурина","30000000 руб., УСН",79870845775,"Земельный участок расположен в ста километрах от Нижнего Новгорода, в самой эколо-гически чистой, заповедной части Нижегородской области. В 12 километрах от участка нахо-дится исторический и религиозный памятник- Макарьевский монастырь- место поломничества людей со всей России.
Участок уникален окружающей природой. Это место считается одним из лучших на Вол-ге по рыбалке. В нескольких километрах от участка есть большое охотоведческое хозяйство куда съезжаются знатоки, чтобы поохотиться на крупного зверя. 

Описание участка
Участок представляет собой вытянутый вдоль берега реки неправильный четырехуголь-ник, площадью 32,962 га. Со сторонами: большая- 1 300 метров, меньшая- 350 метров. Пере-пад высот на всей площади участка не превышает 2 метров.
Расстояние от южной границы участка до р. Волга составляет около 200 метров. На вос-точной границе участка расположено озеро, размером около 200 м2. На западной границе уча-стка расположен небольшой поселок на 25-30 домов. В северной части участ ..., 3 фото",https://www.cian.ru/sale/commercial/166899350
