ID  объявления,Тип,Площадь,Адрес,Цена,Телефоны,Описание,Ссылка на объявление
319412588,Продажа коммерческой земли,"8.13, сот.","Кабардино-Балкарская Республика, Нальчик, улица Калинина, 109","110205 руб., УСН",79188324885,"Лот 1: 
- 9/100 доля в праве долевой собственности на земельный участок, площадью 789 +/- 10 кв.м., назначение: для индивидуального жилищного строительства, адрес (местонахождение): Россия, Респ. Кабардино-Балкарская, г Нальчик, ул. Калинина, дом 109, кадастровый (условный) номер: 07:09:0101038:63;
- 1/15 доля в праве долевой собственности на жилой дом, площадью 130.8 кв.м., назначение: ЖИЛОЕ, адрес (местонахождение): Россия, Респ. Кабардино-Балкарская, г Нальчик, ул. Калинина, дом 109, кадастровый (условный) номер: 07:09:0000000:24011.
Точную информацию по НДС смотрите на сайте ЭТП",https://www.cian.ru/sale/commercial/319412588
319277354,Продажа коммерческой земли,"7.0, сот.","Кабардино-Балкарская Республика, Нальчик, Эльбрус СТ","1600000 руб., УСН",79889393110,"продаётся дачный участок в С/Т Эльбрус  84 , микрорайона Горный, 7 соток , солнечная сторона. Учаcтoк poвный и нa вoзвышенности, хopоший вид на гоpы и гopoд, ктo мечтaл o дoме с видoм)) . Имеет нeсколько пoдъезда к нeму. Cвет, вода пepед участком, гaз рядoм, скоро будут заводить. C концa acфальта по ул. Цeнтральной , до учaстка 5 минут пешком. На участке железный гараж. Имеются стройматериалы : щебенка, туф, кирпич., 1 фото",https://www.cian.ru/sale/commercial/319277354
258509588,Продажа коммерческой земли,"30.0, сот.","Кабардино-Балкарская Республика, Нальчик, улица Атажукина","1600000 руб., УСН",79187251218,"Земельный участок рядом с магнитом. Вся инфраструктура есть, можно перевести  под многоэтажный дом.",https://www.cian.ru/sale/commercial/258509588
318722007,Продажа коммерческой земли,"1.0, сот.","Кабардино-Балкарская Республика, Нальчик, улица Солнечная, 101","2000001 руб., УСН",79187230546,"Продается земельный участок в районе со стремительно развивающейся инфраструктурой!
Идеальное решение для инвестора или предпринимателя,желающего построить малоэтажный многоквартирный дом или коммерческое предприятие,например, продовольственный магазин или кафетерий

На участке площадью 1 сотку (размеры 15х7 м) можно реализовать как жилой проект,так и коммерческую застройку.Участок расположен в районе с активно развивающейся инфраструктурой,что обеспечивает удобство для будущих жильцов или посетителей.
Обременений по документам не зарегистрировано,все необходимые документы готовы
Планировка участка позволяет реализовать разнообразные идеи: строительство малоэтажного жилого комплекса или коммерческого объекта.Есть возможность переделки под бизнес-проект,что делает его особенно привлекательным для инвестиций

ЗВОНИТЕ!
Будем рады ответить на все ваши вопросы и помочь с оформлением сделки!


Арт. 107414321, 13 фото",https://www.cian.ru/sale/commercial/318722007
320410835,Продажа коммерческой земли,"10.0, сот.","Кабардино-Балкарская Республика, Нальчик, улица Шогенова, 50","5500007 руб., УСН",79889312476,"Продается земельный участок 10 соток!!!Выгодное предложение!!!

Подойдет под коммерцию
Складское помещение
Малярный цех
Мойку авто
Участок чистый, сносить, вывозить ничего не нужно
На участке есть незаконченное строение
Возможен обмен на участок под строительство коммерческого объекта в Шалушке,Чегеме по трассе

Вся инфраструктура в шаговой доступности
Торг уместен


Без обременений
Один взрослый собственник
Документы в порядке и готовы к переоформлению

Звоните!!!



Арт. 95668080, 12 фото",https://www.cian.ru/sale/commercial/320410835
310427694,Продажа коммерческой земли,"6.5, сот.","Кабардино-Балкарская Республика, Нальчик, улица Осипенко, 55","15000000 руб., УСН",79187212010,"Продаётся участок, кадастровый номер 07:09:0102046:12 под застройку дома. Есть электричество, газ, вода, только строй дом и живи, асфальтированная дорога. Документы на собственность у меня на руках. Старый дом уже снесли и всё готово под строительство нового. Ширина участка 21 метр глубина 42 метра., 2 фото",https://www.cian.ru/sale/commercial/310427694
314201160,"Продажа коммерческой земли, здание","760.0, м2","Кабардино-Балкарская Республика, Нальчик, улица Чернышевского, 56","15000000 руб., УСН",79887202686,"Прoдaётся учаcтoк    !!!! HЕ ПРОМЗOНA !!!! Пеpвaя линия !!!Пpавильной фoрмы Вce кoммуникaции ул. Чeрнышевскогo Пол любой вид дeятельнoсти площадь 7.6 сотокВ шaгoвoй доступности:ТЦ CРЕДAУHИВEРСИТЕТШкoлы и cадикиKaфe и рecтораныAПТЕКИвce документы на pуках , ИЖC, oбмeн вoзможeн (квартиры), 4 фото",https://www.cian.ru/sale/commercial/314201160
314602257,Продажа коммерческой земли,"122.5, сот.","Кабардино-Балкарская Республика, Нальчик, проезд 4-й Промышленный, 10","28000000 руб., УСН",79187200559,"Продаётся участок, правильной формы , в черте города. Все коммуникации идут по границе участка . Подойдёт для производства , складов итд. Оплата по безналичному расчету ,либо наличными., 5 фото",https://www.cian.ru/sale/commercial/314602257
300868510,"Продажа коммерческой земли, здание","9400.0, м2","Кабардино-Балкарская Республика, Нальчик","50000000 руб., УСН",79183929283,"Продается действующая база в собственности в промышленной зоне по середине улицы 3-ий Пром проезд. Выгодное месторасположение для любой торговой, производственной, складской деятельности. Есть все коммуникации: вода, канализация, газ, электричество 240kw ( собственный траснформатор) На территории находятся следующие объекты капительного строительства: - административное здание 520 кв м - цех 157 кв м - весовая, кпп, бытовое помещение - 330 кв м - складские помещения 1155 кв м Построен собственный ж/д тупик. Есть башенный кран КБ-400 и подкрановые пути, 13 фото",https://www.cian.ru/sale/commercial/300868510
