ID  объявления,Тип,Площадь,Адрес,Цена,Телефоны,Описание,Ссылка на объявление
195561381,Продажа коммерческой земли,"12.0, сот.","Приморский край, Находка, пос. Средняя","750000 руб., УСН",+79143312552,"Продам земельный участок под строительство, с велеколепным видом на море. Земля расположена по адресу Находкенский городской округ пос. Средний ул Светлая 22. Участок 12 соток. По вопросам звонить по телефону.
Торг уместен., 2 фото",https://www.cian.ru/sale/commercial/195561381
320399260,Продажа коммерческой земли,"6.13, сот.","Приморский край, Находка, Спортивная улица, 6","1594000 руб., УСН",+79159316267,"Данные получены с сайта ГИС Торги.
В соответствии с Извещением., 2 фото",https://www.cian.ru/sale/commercial/320399260
307389760,Продажа коммерческой земли,"8.8, сот.","Приморский край, Находка, Береговая улица","9000000 руб., УСН","+79149614138, +79149624079","Продается самый ограниченный ресурс - 8,8 соток земной поверхности в собственности на берегу моря. По факту можно присоеденить еще 12 соток рядом, они свободны и граничат с участком.  Предложение эксклюзивное. Большой песчаный пляж, пологий берег, никаких скал. г. Находка, море не замерзает. в 50 метрах 3 пресных озера с рыбками. Здание 42 кв.м и участок в собственности, куплены на аукционе по неслабой цене. Земли населенных пунктов, собственник через госуслуги меняет назначение за 5 дней. Через какое-то время этот пляж будет благоустроен и станет центральным пляжем Находки. Стоимость земли вырастит кратно. Ждем скорейшего завершения СВО и жизнь пойдет своим чередом. Сейчас это выгодное вложение. Стоимость земли, да еще в таком месте растёт гораздо быстрее золота. 1 млн за такую сотку норма. Здание пока 200.000₽. Я собственник. Возможен обмен на спецтехнику или автомобиль., 22 фото",https://www.cian.ru/sale/commercial/307389760
276335718,Продажа коммерческой земли,"13.0, сот.","Приморский край, Находка, Поселок Ливадия мкр","35000000 руб., УСН","+79143309248, +79146708378","Уютная база в Ливадии по привлекательной цене

Рады предложить уникальный объект по адресу:  пос. Ливадия, 
Земля в собственности 1300 кв. м, на территории находятся 11 домов со всеми условиями, из них:
- 10 4хместных домов
- 1 8местный ДВУХЭТАЖНЫЙ дом, с фундаментом под баню 48 кв м

База находится в экологически чистом районе с шаговой доступностью к морю, с собственным бассейном на территории., 9 фото",https://www.cian.ru/sale/commercial/276335718
277727134,Продажа коммерческой земли,"2.8, га","Приморский край, Находка, Красноармейская улица, 30","100000000 руб., УСН",+79143309180,"Продам земельный участок в районе о. Солёное, улицы Красноармейской. Назначение земельного участка - торговля. Договор аренды на 10 лет с правом выкупа. Все постройки, находящиеся на территории участка - в собственности. Рассмотрим предложения по выкупу отдельно выделенных участков на территории. При желании землю можно использовать под железнодорожные пути. Для реального покупателя готовы рассмотреть возможность снижения цены., 8 фото",https://www.cian.ru/sale/commercial/277727134
