ID  объявления,Тип,Площадь,Адрес,Цена,Телефоны,Описание,Ссылка на объявление
320602844,Продажа коммерческой земли,"6.3, сот.","Калининградская область, Советск, Солнышко СНТ","224060 руб., УСН",79114823117,"Данные получены с сайта ГИС Торги.
категория земель - земли населенных пунктов, вид разрешенного использования - для ведения садоводства и огородничества. Местоположение установлено относительно ориентира, расположенного в границах участка. Граница земельного участка не установлена в соответствии с требованиями земельного законодательства., 1 фото",https://www.cian.ru/sale/commercial/320602844
284148899,Продажа коммерческой земли,"50.0, сот.","Калининградская область, Советск, Промышленный переулок, 1","2250000 руб., УСН",79114910178,"Часть земельного участка производственного назначения 5000 кв.м., возможно увеличение  
Центральное водоснабжение. Газ вдоль границы. Подключение электрической мощности по договоренности.
Удобное расположение центр города федеральная трасса. Удобный заезд
Назначение: предоставление гостиничных услуг, придорожный сервис, обслуживание транспорта, торговля, общественное питание, мастерские, размещение складов.
Рассмотрю варианты, возможна продажа по частям, рассрочка, обмен, совместное использование, 4 фото",https://www.cian.ru/sale/commercial/284148899
221327235,Продажа коммерческой земли,"0.78, га","Калининградская область, Советск, Ленинградская улица, 40","11000000 руб., УСН",79814614393,"Продается производственная база 0,78 га в собственности с ж/д тупиком. Территория асфальтирована. Продажа от собственника., 3 фото",https://www.cian.ru/sale/commercial/221327235
281034622,Продажа коммерческой земли,"89.0, сот.","Калининградская область, Советск","12000000 руб., УСН",79114513781,"Земельный участок в центре города со всеми коммуникациями (Газ, вода, канализация, электричество - разрешенная мощность - 120 кВт). На земельном участке расположено здание трансформаторного пункта. в настоящее времявозможно изменение разрешенного использования земли под строительство многоквартирного дома.
Земельный участок и здание продаются одновременно за 12 000 000 рублей., 6 фото",https://www.cian.ru/sale/commercial/281034622
303465685,"Продажа коммерческой земли, здание","8890.0, м2","Калининградская область, Советск","12000000 руб., УСН",79114602265,"Кадастровый номер: 39:16:010512:8. Земельный участок в центре города Советска, со всеми коммуникациями( газ, вода, канализация, электричество -120 кВт ). на земельном участке расположена трансформаторная, 1 фото",https://www.cian.ru/sale/commercial/303465685
