ID  объявления,Тип,Площадь,Адрес,Цена,Телефоны,Описание,Ссылка на объявление
191526150,Продажа коммерческой земли,"74.92, сот.","Томская область, Томск, тракт Шегарский, 1В","51000000 руб., УСН",+79138514479,"Земельный участок с объектом незавершенного строительства (фундамент площадью 1,4 тыс. кв. м., (входит в стоимость земельного участка). Предлагаемый к продаже земельный участок кадастровый номер : 70:14:0100039:410, размером 7 492 кв. м. находится в перспективной, активно осваиваемой левобережной части г. Томска (жилищное строительство, объекты торговли, отдыха, общественного питания), в непосредственной близости от центральной части города, на первой линии от федеральной автомобильной дороги Р 398. Кадастровая стоимость аналогичных участков в непосредственной близости от предлагаемого нами земельного участка составляет в среднем около 1 млн. руб. за 100 кв. м.
К земельному участку подведены все коммуникации: газ, электричество, водоснабжение. Канализация - индивидуальные выгребные ямы, связь, ливневая канализация - отсутствуют. Собственность. Обременений нет. Ближайшая автобусная остановка  100-150 м, станция метро,  остановки трамвая-нет, ближайшая жд. станция  Томск-2., 6 фото",https://www.cian.ru/sale/commercial/191526150
172601253,Продажа коммерческой земли,"74.9, сот.","Томская область, Томск, тракт Шегарский, 1В","55000000 руб., УСН",+79138105620,"Разумный торг. Предлагаемый к продаже земельный участок кадастровый номер : 70:14:0100039:410, размером 7 492 кв. м. находится в перспективной, активно осваиваемой левобережной части г. Томска (жилищное строительство, объекты торговли, отдыха, общественного питания), в непосредственной близости от центральной части города, на первой линии от федеральной автомобильной дороги Р 398. Кадастровая стоимость аналогичных участков в непосредственной близости от предлагаемого нами земельного участка составляет в среднем около 1 млн. руб. за 100 кв. м. (для примера участки кадастровый номер : 70:21:0100085:9, 70:21:0100085:1, 70:21:0200036:4).
Так же на предлагаемом нами участке находится объект незавершенного строительства (фундамент) площадью 1,4 тыс. кв. м. , себестоимость объекта в ценах на 2017 г. составляет около 12 млн. руб.
К земельному участку подведены все коммуникации: газ, электричество, водоснабжение.   55 000 000, 3 фото",https://www.cian.ru/sale/commercial/172601253
309489513,Продажа коммерческой земли,"3.0, га","Томская область, Томск, улица Нефтяная, 1с2","60000000 руб., УСН",+79131004508,"Участок общей площадью 3 гектаров (31246кв.м), как промназначения под любой вид использования, также и жилого многоэтажного строительства, имеется ГПЗУ. Категория земель: Земли поселений (земли населенных пунктов). Многоквартирные многоэтажные жилые дома выше 16 этажей, многоквартирные многоэтажные жилые дома 11-16 этажей. Центральные коммуникации: электричество, газ, отопление, водоснабжение, канализация. Для дополнительной информации мы на связи., 5 фото",https://www.cian.ru/sale/commercial/309489513
319006230,Продажа коммерческой земли,"48.01, сот.","Томская область, Томск, улица Войкова, 78","105000000 руб., УСН",+79131002073,"В продаже земельный участок 4801 м² для многоэтажной жилой застройки в близи центра города между улицами Войкова, Мельничная, Пролетарская и пер. Дербышевским. Участок готов к жилой застройке, без зарегистрированных строений и коммуникаций проходящих через участок. Есть возможность подключения к центральным коммуникациям города: вода, канализация, электричество, газ. Один собственник. Буду рад ответить на ваши вопросы. Звоните сейчас!            




Код пользователя: 132764
Номер в базе: 8724614, 10 фото",https://www.cian.ru/sale/commercial/319006230
292426228,Продажа коммерческой земли,"130.0, сот.","Томская область, Томск, Черемошники мкр, улица Нижне-Луговая, 37А","127900000 руб., УСН","+79138808323, +79138810528","Продается Земельный участок площадью 1,3 га с 4 строениями общей площадью 1325 кв.м.
Участок разделен на 2 участка: 9 549 кв.м. и 2 774 кв.м. (Фото 2 и 3)

по адресу: г.Томск, ул.Нижне-Луговая, 37а
Участок находится в территориальной зоне Ж2  зона застройки малоэтажными и среднеэтажными жилыми домами (например: под многоквартирные дома до 8 этажей, бизнес центр, торгово развлекательный комплекс, спорткомплекс, торговый центр, объекты профессионального образования, школу, размещение органов управления политических партий, церкви, храма). 
На одном участке находится распределительный щит на 150 киловатт, конечная точка ЛЭП. На участке проходит коммуникация, водопровод.
На земельных участках находятся 4 строения, находящиеся в собственности физического лица. 

800 метров до реки Томь, рядом строительный магазин Стройся, в шаговой доступности торговые центры, ТРЦ Мегаполис, Кинотеатр, продуктовый магазин Магнит, детские сады и школы, остановки общественного транспорта, ключевая вода.

Площ ..., 4 фото",https://www.cian.ru/sale/commercial/292426228
309276672,Продажа коммерческой земли,"3.9, га","Томская область, Томск, улица Мичурина, 114","199999999 руб., УСН",+79131004508,"Земли для размещения промышленных объектов, промышленные предприятия и коммунально-складские организации IV-V классов вредности. 5-ть капитальных строений, как отапливаемые, так неотапливаемые с различным промышленным оборудованием, входят: подcтaнция KТПП-10кВ-2х630KBА, газовая котельная, cкважина и кaбельныe линии дo PУ-10кВ (свыше 1000 кВт), видеонаблюдение, круглосуточная охрана. Перспектива строительства новых сооружений. Имеющиеся объекты заполнены арендаторам, приносящий стабильный доход., 11 фото",https://www.cian.ru/sale/commercial/309276672
