ID  объявления,Тип,Площадь,Адрес,Цена,Телефоны,Описание,Ссылка на объявление
318067171,Продажа коммерческой земли,"45.88, сот.","Томская область, Томск, Ракетная улица, 4Б","81999999 руб., УСН",+79832302917,"Земельный участок с отдельно стоящим зданием.
Продам Земельный участок площадью 45,88 сот. ( г Томск ул Ракетная 4б). Участок ровный, прямоугольной формы, заасфальтированный. Все коммуникации. Прямой выезд на Ракетную.
Территория огорожена капитальным забором.
Здание площадью 489 кв. метров. После реконструкции и капитального ремонта. Сквозной проезд, сдвижные ворота под еврофуру с каждой стороны. В помещение заведены все коммуникации. Внутри оборудованы комната для персонала, офис, санузел.
Цена за всё  - 81 999 999 рублей., 9 фото",https://www.cian.ru/sale/commercial/318067171
308160439,Продажа коммерческой земли,"15.0, сот.","Томская область, Томск, пос. Родионово, улица Российская, 33","1500000 руб., УСН",+79131104576,"Собственник. Поселок входит в программу газификации. Есть центральные коммуникации: электричество. 
Документы готовы

Неподалеку будут строить студенческий кампус,  развитие района не заставит себя ждать., 5 фото",https://www.cian.ru/sale/commercial/308160439
319927897,Продажа коммерческой земли,"4.0, сот.","Томская область, Томск, переулок Плеханова, 36","3100000 руб., УСН",+79131004748,"Продается участок в самом центре города, но в то же время в стороне от городской суеты. До участка асфальтированная дорога, рядом проходят трамвайные пути. В пешей доступности не только магазины, поликлиники, аптеки, а вообще все блага цивилизации нашего города. Данный участок отлично подойдет под строительство индивидуального жилого дома. Так же можно использовать землю для строительства бани-беседки для сдачи. Приобретая данный участок вы сможете воплотить в жизнь любые идеи, связанные с недвижимостью.

Арт. 111309252, 5 фото",https://www.cian.ru/sale/commercial/319927897
265724986,Продажа коммерческой земли,"12.5, сот.","Томская область, Томск, пос. Степановка, переулок Богдана Хмельницкого, 6","6000000 руб., УСН",+79138523431,"Земельный участок расположенный на Степановке, возможное использование для строительства многоквартирных домов 5-10 этаж, магазина,промышленного объекта, 4 фото",https://www.cian.ru/sale/commercial/265724986
320137793,Продажа коммерческой земли,"8.21, сот.","Томская область, Томск, улица Челюскинцев, 4В","6978500 руб., УСН",+79850418992,"Продам земельный участок по адресу Челюскинцев 4б (пересечение с ул. Степана Разина, напротив домов  11а и 14), площадью 821 кв.м, кадастровый номер: 70: 21: 0200006: 302.
Участок полностью расположен в зоне Ж-1, что позволяет использовать его практически под любые виды деятельности.
Хорошая транспортная доступность.
Рассмотрю адекватные варианты обмена на недвижимость или авто с доплатой в обе стороны., 9 фото",https://www.cian.ru/sale/commercial/320137793
304521879,Продажа коммерческой земли,"22.0, сот.","Томская область, Томск, улица Александра Угрюмова, 7/1","8200000 руб., УСН",+79131004508,"Производственная бетонная площадка, с козловым краном грузоподъёмностью 12.5тн ( под восстановление, лишь нет кабеля), вагончик для охраны. холодный ангар 100м.кв с кран балкой 2 тн, холодный склад 30 м.кв, помещение под офис 20 м.кв в рядом стоящем здании, удобный проезд/заезд., 10 фото",https://www.cian.ru/sale/commercial/304521879
313288996,Продажа коммерческой земли,"50.0, сот.","Томская область, Томск, улица Владимира Высоцкого","9000000 руб., УСН",+79833405631,"Земельный участок в районе приборного завода. Кад. 70:14:0300092:11861 площадь 5000м2,  Земли промышленности, энергетики, транспорта, связи, радиовещания, телевидения, информатики, земли для обеспечения космической деятельности, земли обороны, безопасности и земли иного специального назначения.Вид разрешённого использования: для строительства и эксплуатации  промышленно-производственных и складских помещений., 1 фото",https://www.cian.ru/sale/commercial/313288996
311184860,Продажа коммерческой земли,"53.0, сот.","Томская область, Томск, улица 2-я Усть-Киргизка, 23с3","9999999 руб., УСН",+79131004508,"Промка. Зона производственно-коммунальных объектов IV-V классов вредности. Открытая площадка, частичное ограждение, ж/д ветка. Неограниченные электро/мощности.  Благоприятный подъезд, в близи городской инфраструктуры., 5 фото",https://www.cian.ru/sale/commercial/311184860
320463826,Продажа коммерческой земли,"63.0, сот.","Томская область, Томск, улица Ивановского, 8/5","12000000 руб., УСН",+79131004508,"Продажа участка под промышленно-производственное использование, с удобным подъездом и коммуникациями по границе используемой территории, по оценочной стоимости адекватная относительно данной локации. На остальные вопросы, могли бы ответить по мере запроса., 3 фото",https://www.cian.ru/sale/commercial/320463826
318997684,Продажа коммерческой земли,"56.0, сот.","Томская область, Томск, улица 2-я Усть-Киргизка, 23/1","12999000 руб., УСН",+79131004508,"Промка. Зона производственно-коммунальных объектов IV-V классов вредности. Открытая площадка, ж/д ветка, кран башенный БКСМ-14 ПМ-2  5тн/гр с подкрановыми путями и ж/д тупиком. Неограниченные электро/мощности.  Благоприятный подъезд, в близи городской инфраструктуры., 4 фото",https://www.cian.ru/sale/commercial/318997684
319958487,Продажа коммерческой земли,"15.0, сот.","Томская область, Томск, Черемошники мкр, улица Строевая, 14","13000000 руб., УСН",+79138106223,"Oтличный участок c огpомным коммерчеcким потeнциалом. 
Удoбная фоpмa позвoляeт cтpoить пpоекты рaзнoго направления и фoрмы. 
Pядoм центрaльная вода, гaз и кaнaлизация. 
За зeмельным учaстoк еcть pека, кoтopая укрaсит вaш прoeкт (апapтамeнты, панcионaт, дeтcкo\спoртивнoе нaпpавлeние) 
В шаговой доступности остановка общественного транспорта, вокруг огромный жилой массив. 
Зона ж-2 ( в том числе многоквартирные дома), ограничений на участке для строительства нет. Звоните, отвечу на ваши вопросы!, 8 фото",https://www.cian.ru/sale/commercial/319958487
304828235,Продажа коммерческой земли,"100.0, сот.","Томская область, Томск, Причальная улица, 1","15000000 руб., УСН",+79833405631,"Земельный участок на первой линии  по ул.Мостовой  с кад.номером 70:21:0100093:771 предназначен для строительства и последующей эксплуатации накопительной и складской площадки. Все коммуникации на границы. Ориентир  кафе  ""У фонтана"", 5 фото",https://www.cian.ru/sale/commercial/304828235
303896361,Продажа коммерческой земли,"50.0, сот.","Томская область, Томск, Березовая улица","16000000 руб., УСН",+79131004508,"Территория муниципального образования 50 соток, с капитальным строением(640m), высота потолков достигает 9м, наличие коммуникаций. Электричество 100 кВт, с возможность увлечения, с большим объемом скважина на 120м, центральная канализация., 20 фото",https://www.cian.ru/sale/commercial/303896361
315149211,Продажа коммерческой земли,"14.0, сот.","Томская область, Томск, Кирпичная улица, 1","16000000 руб., УСН",+79131004508,"Эксклюзив под развитие любой направленности жилого/коммерческого назначения. Расширенный вид разрешенного использования земельного участка, также объекта капитального строительства. Центральные коммуникации, подъезд, видовое расположение ,благоприятное соседство для популяризации любого вида деятельности, единоличная собственность, более пяти лет. При реальной заинтересованности, готовы предоставить полную документацию, осуществить наглядный просмотр., 8 фото",https://www.cian.ru/sale/commercial/315149211
295685752,Продажа коммерческой земли,"30.0, сот.","Томская область, Томск, проспект Кирова","18000000 руб., УСН",+79833405631,"Продаётся аренда участка с кад.номером 70:21;0200018:360 площадью 30 соток, так же есть документы на объект незавершённого строительства площадью 1300м2, получены проекты на строительство. Участок находится на территории бывшего Сибэлектромотора, где сейчас ведётся активное строительство нового микрорайона. На первом фото видно, что в перспективе наш участок будет стоять на первой линии., 2 фото",https://www.cian.ru/sale/commercial/295685752
305166563,Продажа коммерческой земли,"34.0, сот.","Томская область, Томск, улица Пушкина, 63/21","19000000 руб., УСН",+79131004508,"Продается участок для разнообразного вида использования. При реальной заинтересованности, готовы предоставить для анализа гпзу., 5 фото",https://www.cian.ru/sale/commercial/305166563
319913162,Продажа коммерческой земли,"36.0, сот.","Томская область, Томск, Водяная улица, 90/5","20000000 руб., УСН",+79830531400,"Земельный участок с кад 70:21:00035:1453 площадью 36 соток. Зона О-5. Коммуникации городские, на границе газ. Ориентир - напротив дома по адресу ул.Водяная 90/5., 1 фото",https://www.cian.ru/sale/commercial/319913162
314185666,"Продажа коммерческой земли, здание","1661400.0, м2","Томская область, Томск, тракт Иркутский, 236","20000000 руб., УСН",+79138403710,"Пpoдaётся уникaльный земeльный участок общей плoщадью 16614 м}, cоcтоящий из двух cмeжныx учaсткoв (5763 м и 10851 м7), pacпoложенный на Иркутcком тpакте, в непосредствeннoй близоcти от пoворoтa наКоpнилoвo. Это идeальнoе меcтo для реализации вашиx бизнeс-идей или сoздания загорoдногo угoлка. На учacткe ужe зaвeдено электричество, имеется трансформаторная будка мощностью 250 кВт, что обеспечит вам бесперебойное энергоснабжение. На маленьком участке есть готовый проект на 1400 кв.м (по фото видно)и разрешение на строительство магазина, кафе и гостиницы - отличная возможность для инвестиций! Есть желающие взять в аренду построение объекты Большой участок вы можете использовать по своему усмотрению, реализуя любые свои задумки. Например, дома отдыха.Генеральный план земельного использования (ГПЗУ) позволяет реализовать данный бизнес..Со стороны трассы установлен современный забор из профнастила с раздвижными воротами, что обеспечивает безопасность и удобный доступ.К участку ведёт хороший  ..., 8 фото",https://www.cian.ru/sale/commercial/314185666
317768953,Продажа коммерческой земли,"14.0, сот.","Томская область, Томск, улица 1-я Рабочая, 15","21500000 руб., УСН",+79138607081,"К продаже два смежных участка общей площадью 14 соток,зона ОЖ до 8 этажей,ГПЗУ есть,отправлю по запросу, 3 фото",https://www.cian.ru/sale/commercial/317768953
311139344,Продажа коммерческой земли,"1.09, га","Томская область, Томск, улица 2-я Усть-Киргизка, 23с3","22888888 руб., УСН",+79131004508,"Промка. Зона производственно-коммунальных объектов IV-V классов вредности. Открытая площадка, ж/д ветка, кран башенный БКСМ-14 ПМ-2 гр 5тн с подкрановыми путями и ж/д тупиком. Неограниченные электро/мощности.  Благоприятный подъезд, в близи городской инфраструктуры., 8 фото",https://www.cian.ru/sale/commercial/311139344
309858152,Продажа коммерческой земли,"16.0, сот.","Томская область, Томск, улица Кузнечный Взвоз, 12","30000000 руб., УСН",+79131004508,"Центральная часть города, видовое место под застройку элитного многоквартирного жилого дом, до 4-х этажей или здания свободного назначения (учебного, медицинского, офисного)., 5 фото",https://www.cian.ru/sale/commercial/309858152
305885315,Продажа коммерческой земли,"68.0, сот.","Томская область, Томск, с. Тимирязевское, Юбилейный мкр","35000000 руб., УСН",+79833405631,"Четыре смежных участка находятся по трассе Шегарский тракт в мкр. Юбилейном 
Кад   70:14:0100010:151  по адресу  мкр. Юбилейный 8	 S= 1974 м2
Кад   70:14:0100010:205  по адресу  Юбилейный 8/2      S=1661м2
Кад   70:14:0100010:206   по адресу Юбилейный 8/1	 S=2044м2
Кад   70:14:0100010:207 по адресу  Юбилейный 8/3  S=1142 м2
Итого общая площадь 	6821м2.
Находятся на первой линии ,земли промышленности энергетики и транспорта., 3 фото",https://www.cian.ru/sale/commercial/305885315
305884988,Продажа коммерческой земли,"68.0, сот.","Томская область, Томск, с. Тимирязевское, Юбилейный мкр","35000000 руб., УСН",+79833405631,"Четыре смежных участка находятся по трассе Шегарский тракт в мкр. Юбилейном 
Кад   70:14:0100010:151  по адресу  мкр. Юбилейный 8	 S= 1974 м2
Кад   70:14:0100010:205  по адресу  Юбилейный 8/2      S=1661м2
Кад   70:14:0100010:206   по адресу Юбилейный 8/1	 S=2044м2
Кад   70:14:0100010:207 по адресу  Юбилейный 8/3  S=1142 м2
Итого общая площадь 	6821м2.
По документам категория земель  земли промышленности энергетики транспорта, но находятся в зоне Ж-3, поэтому возможное использование следующее: торговые центры, склады и коттеджное строительство. На границе участка шикарная асфальтированная  липово-яблочная аллея., 4 фото",https://www.cian.ru/sale/commercial/305884988
318792655,"Продажа коммерческой земли, здание","20900.0, м2","Томская область, Томск, Кузовлевский тракт, 12","37000000 руб., УСН",+79824415235,"Продается земельный участок пром назначения 70:21:0104004:8 общей площадью 20912,00 кв. М. На участке находятся:

1. Нежилое здание: Кадастровый номер 70:21:0104004:413 Площадь 2780 кв. М.

2. Нежилое здание: Кадастровый номер 70:21:0104004:253 Площадь 2771,5 кв. М.

3. Нежилое здание: Кадастровый номер 70:21:0104004:307 Площадь 2750,4 кв. М.

4. Нежилое здание: Кадастровый номер 70:21:0104004:315 Площадь 1068,4 кв. М.

5. Нежилое здание: Кадастровый номер 70:21:0104004:518 Площадь 115,8 кв. М.

6. Канализационная — насосная станция: Кадастровый номер 70:21:0104004:517 Площадь 42,9 кв. М.

Продам отдельно земельный участок 150 000р за сотку.

Есть возможность подключить электричество 180 квт.

Рассмотрим варианты обмена: недвижимость, автомобили грузовые или легковые., 17 фото",https://www.cian.ru/sale/commercial/318792655
320135410,Продажа коммерческой земли,"32.0, сот.","Томская область, Томск, Солнечный мкр","40000000 руб., УСН",+79138610102,"Продаётся земельный участок 32 сотки в мкр. Солнечный, фактический адрес: г. Томск, ул. Клюева, 4г. 

Рядом находится супермаркет Стройся. 

Все коммуникации на участке центральные. 

Основные виды разрешённого использования: многоэтажная жилая застройка (высотная застройка).,  
среднеэтажная жилая застройка, благоустройство территории.

ГПЗУ в наличии. 

Звоните!!

																 JC000050070002, 11 фото",https://www.cian.ru/sale/commercial/320135410
318878994,"Продажа коммерческой земли, здание","31.0, м2","Томская область, Томск, Солнечный мкр","40000000 руб., УСН",+79131044782,"Прoдaм земeльный учаcтoк в очень хоpошeм активно paзвивaющемся pайoнe гopoда, недалeкo от магазина Meтро. С выездом на Kлюeвa. Bce коммуникации зaведены.

Bозмoжно объeдинить c coсeдним учaстком, на котopом нa дaнный момeнт pacположeн магазин Стpойся.

Нaзнaчeние земли - земля под строительство магазина, можно поменять на другое, по необходимости. (Беру на себя), 10 фото",https://www.cian.ru/sale/commercial/318878994
319283748,Продажа коммерческой земли,"66.79, сот.","Томская область, Томск, проспект Ленина, 217с30","49900000 руб., УСН",+79835987232,"Собственник.
Продам производственную базу с собственным железнодорожным тупиком, железнодорожными весами, автовесами и стационарным краном.

Ж.Д. тупик (важно ПРЯМОЙ, подача и уборка вагонов производится быстрее), примыкающий к станции Томск-грузовой, полезная длина путей 166 м.
Ж.Д. тупик подходит для выгрузки сыпучих материалов (повышенный путь на одну сторону).

Ж.Д весы (собственные), предел взвешивания 150 тн.

Автомобильные весы (собственные), предел взвешивания 60тн.

Кран ГПК-5 (собственный, электрический) грузоподъёмность 5 тн.

На территории расположено строение 2 этажа, площадь 50 м.кв., вагончики для сотрудников базы.

Земельный участок 6679 кв.м., фактически огорожено 10000 кв.м.(см.фото).

Электричество 380 кВт.

База расположена в удобной транспортной локации.

В настоящее время база сдана в аренду.

Торг есть., 16 фото",https://www.cian.ru/sale/commercial/319283748
